date,timestamp,speaker,text
2020-03-18,19:18,Donald Trump,"Thank you very much. I would like to begin by announcing some important developments in our war against the Chinese virus. We’ll be invoking the defense production act just in case we need it. In other words, I think you all know what it is and it can do a lot of good things if we need it and we will have it all completed signing it in just a little while. Right after I’m finished with this conference, I’ll be signing it. It’s prepared to go. So we will be invoking the Defense Production Act. Last week I signed an emergency declaration under the Stafford Act, which is we invoked previously and which activated FEMA National Response Coordination Center, FEMA is fully engaged at the highest levels."
2020-03-18,20:16,Donald Trump,"Today FEMA is activated in every region. We are at level one, level one being the highest level which we will work with and we’ve been working with FEMA. I’ve done a lot of work with FEMA. They’re incredible. It’s always been on hurricanes or tornadoes. There right now in Tennessee, a large group working in Tennessee have been incredible. It was tragic event Alabama last year, also a tornado and then obviously the numerous hurricanes in different locations that were in some cases very devastating and in every case FEMA came through. This is a very different kind of work for FEMA, but they will come through as they always do."
2020-03-18,21:02,Donald Trump,"We have tremendous people, tremendous talent in FEMA. We’re sending upon request the two hospital ships, they’re being prepared right now. They’re massive ships. They’re the big white ships with the red cross on the sides. One is called The Mercy and the other is called The Comfort and they are in tiptop shape. They soon will be. They’re getting ready to come up to New York. I spoke with governor Cuomo about it. He’s excited about it. We haven’t made the final determination as to where it’s going to go on the West coast. The Comfort is located now in San Diego and it’s going to be… We’ll be picking the destination fairly shortly, so those two ships are being prepared to go and they can be launched over the next week or so depending on need."
2020-03-18,21:56,Donald Trump,"Earlier this week, the first clinical trial of the vaccine candidate for the virus began in Washington state, as you probably know. The genetic sequence of the virus was first published in January, but thanks to the unprecedented partnership between the FDA, NIH, and the private sector, we’ve reached human trials for the vaccine just eight weeks later. It’s a record by many, many months. It used to take years to do this and now we did it just in a very short while. That’s the fastest development in history of what we’re doing with regard to the vaccine and making very, very big progress."
2020-03-18,22:36,Donald Trump,"Today I can announce further steps to expand testing capacity. We’re working with several groups to determine if the self swab a much easier process than the current process. That’s a not very nice to do. I can tell you because I did it. But we have a current process that’s a little bit difficult. If you haven’t done. The groups are working on determining if a self swab by an individual is as effective as the other. The others very effective, very accurate but we’re going to see if we can do a self swab which would be a lot more popular. I can tell you that. So and that would be administered also by a health official but it would be a lot easier to do. The fact is that the health professionals would… It would free up a lot. Let me just say the self swab is what it is. It’s a self swab. You do it yourself."
2020-03-18,23:40,Donald Trump,"The other has to be issued by a health professional and it’s something that is quite difficult and we think it’s working out for the self swab. If it would test positive that people would go and they would do what they have to do, but we think that’s probably working out. I’ve asked the FDA to cut through the red tape and reduce regulatory barriers. We are looking at some very exciting things and I’m going to be holding the second news conference either today. We’re going to talk about the FDA. Some things are happening that are quite exciting and we’re going to be doing that either later today or tomorrow, fairly early tomorrow. So we’ll see what happens. But the FDA, my instructions is I’ve been working very, very hard on a number of developments and we’ll be discussing that with you later today or tomorrow."
2020-03-18,24:35,Donald Trump,This afternoon I’ll be meeting with nurses on the front lines of the battle against the virus. They’re truly American heroes. They want to get it done. They’re incredible people. So we’re going to be meeting with nurses and I actually look forward to that. Very brave. They’re taking a lot of risk and they have done an incredible job and they never complain.
2020-03-18,24:59,Donald Trump,Today I’m also announcing that the department of housing and urban development is providing immediate relief to renters and homeowners by suspending all foreclosures and evictions until the end of April. So we’re working very closely with Dr. Ben Carson and everybody from HUD. Every generation of American has been called to make shared sacrifices for the good of the nation.
2020-03-18,25:23,Donald Trump,In World War II young people in their teenage years volunteered to fight. They wanted to fight so badly because they love our country. Workers refuse to go home and slept in factory floors to keep assembly lines running. The numbers of ships that they built during World War II to this day has never… Nothing like that has ever been equal. They were doing ships literally on a daily basis. Nobody’s ever seen anything like it and to this day nobody seen anything like that. What they were able to do during World War II and now it’s our time. We must sacrifice together because we are all in this together and we’ll come through together.
2020-03-18,26:03,Donald Trump,"We are all in this together and we’ll come through together. It’s the invisible enemy. That’s always the toughest enemy, the invisible enemy, but we are going to defeat the invisible enemy. I think we’re going to do it even faster than we thought and it will be a complete victory. It’ll be a total victory."
2020-03-18,26:19,Donald Trump,"So we’ll have a second conference, again having to do with the FDA on this. I think it’s going to be potentially a very exciting news conference and we will do it as quickly as we can, so whether it’s today or tomorrow. And I’ll, with that, ask, Mike Pence to say a few words and thank you very much."
2020-03-18,26:42,Mike Pence,"Thank you Mr. President. The White House Coronavirus Task Force met this morning and now that we have cases in all 50 States, we’re continuing to move out on the president’s call to bring the full resources of the federal government, a full partnership with every state and territory, the full power of the American economy to support businesses and families. As the president says to us and everyday, “We’ll do whatever it takes. We’re all in this together.”"
2020-03-18,27:10,Mike Pence,"Yesterday, the president met with the tourism industry executives and also had an engaging discussion with all the top companies in our industrial and medical supply chain. Now, the president, as you all are aware, also announced today that by mutual consent the Northern border to Canada will be close to non-essential travel. This does not include essential travel or the transit of goods, but it was through a mutual discussion that took place this morning between the president and Prime Minister Trudeau and the Department of Homeland Security will be effectuating that decision."
2020-03-18,27:46,Mike Pence,"The president spoke with some of the nation’s top business leaders today, again to speak about the supply chain in the country. And for our part, we’re going to be conducting a conference call later today with state and local health officials to renew our ongoing commitment of cooperation and collaboration."
2020-03-18,28:07,Mike Pence,"As the president said last week in signing the Stafford Act, he stood up the National Response Coordination Center and today at the president’s direction, FEMA has gone to Level 1. FEMA’s mission is to support disasters that are locally executed, state managed and federally supported. And tomorrow, the president will be hosting all the nation’s governors from a video conference at FEMA to ensure that they have a full connection to all of the activated regions for FEMA going forward."
2020-03-18,28:43,Mike Pence,"And with regard to testing, I’m pleased to report that we’re increasing the number of tests being performed by the thousands every day thanks to the public private partnership that President Trump forged with commercial laboratories around the country."
2020-03-18,28:58,Mike Pence,"Our health experts tell us to remind every American, it’s important to remember people without symptoms should not get tested. We want to make sure that the supply of testing is there for those that need it most or are symptomatic or in the vulnerable population."
2020-03-18,29:15,Mike Pence,"Dr Deborah Birks, in a moment, will address the progress that we’re making on testing, the infection rate, our recommendations to every America as well as some important new findings about the impact on youth that we’re gaining from data that’s coming in from Europe. That’ll be important to every, every American."
2020-03-18,29:35,Mike Pence,"On the subject of supplies, the president has our task force extremely focused as the president mentioned yesterday, mentioned that he’s invoking the Defense Production Act today. Secretary Esper, in a few moments, will describe the ongoing efforts that the Department of Defense is taking to make medical resources available."
2020-03-18,29:54,Mike Pence,"Secretary Robert Wilkie will announce decisions the VA has made to expand hospital capacity within their system. Also, with regard to medical personnel, at the president’s direction, HHS is issuing a regulation today that will allow all doctors and medical professionals to practice across state lines to meet the needs of hospitals that may arise in adjoining areas."
2020-03-18,30:18,Mike Pence,"In addition to that, we are again today, asking every American and our medical community leaders and hospitals to partner with us in delaying elective procedures across the country in our healthcare system to ensure that medical supplies and medical capacity go where they’re needed most. Seema Verma will describe guidance that CMS will be issuing on that front."
2020-03-18,30:44,Mike Pence,"And finally, just I want to remind every American of the president’s 15-day Guidance to slow the spread. We are grateful for members of the media and the general public that are adhering to these, sharing them with neighbors and friends. All of our experts continue to believe that if every American will do their part and embrace and put into practice these principles that we can significantly limit the reach of the coronavirus in the weeks and months ahead. Thank you, Mr. President."
2020-03-18,31:13,Donald Trump,"Thank you very much. Dr. Birks, please."
2020-03-18,31:13,Deborah Birx,"Thank you. Thank you, Mr. President and Mr. Vice President. So you know, we continue to look at data every single day. There are concerning reports coming out of France and Italy about some young people getting seriously ill and very seriously ill in the ICUs. We think part of this may be that people heeded the early data coming out of China and coming out of South Korea about the elderly or those with preexisting medical conditions were at particular risk."
2020-03-18,31:48,Deborah Birx,"It may have been that the millennial generation, our largest generation, our future generation that will carry us through for the next multiple decades, there may be disproportional number of infections among that group. And so, even if it’s a rare occurrence, it may be seen more frequently in that group and be evident now. So we’re looking at that information very carefully."
2020-03-18,32:14,Deborah Birx,"We have not seen any significant mortality in the children, but we are concerned about the early reports coming out of Italy and France."
2020-03-18,32:25,Deborah Birx,"So again, I’m going to call on that generation that’s part of that group that brought us innovation, particularly throughout all of their ability to look around corners and skip through games. I always went level by level. I didn’t realize that you could go from level three to level seven. That’s what they’ve taught us. They look for things that we don’t see. We need them to be healthy."
2020-03-18,32:49,Deborah Birx,"So again, I’m not only calling on you to adheed what’s in the guidance, but to really ensure that each and every one of you are protecting each other. And so, we cannot have these large gatherings that continue to occur throughout the country for people who are off work to then be socializing in large groups and spreading the virus. You have the potential then to spread it to someone who does have a condition that none of us knew about and cause them to have a disastrous outcome."
2020-03-18,33:17,Deborah Birx,"Finally, on the testing piece and what we’re learning. I know you know last week and bringing the private sector, I think what has been exciting to me over the last two and a half weeks is to see this administration harness the full capacity of the private sector, understanding that a lot of our solutions that we need to confront this virus rely on the private sector. Bringing the private sector commercial labs was critical into this process. We are now beginning to see that they have spread out in a prioritized way because we asked them to prioritize the regions that were mostly affected. And so, you still may have difficulty getting tests in areas that do not have significant cases. We’ve had them prioritize the regions where we need diagnosis and their diagnostic percent."
2020-03-18,34:03,Deborah Birx,"Remember, I told you South Korea was under 4%, so 96% of people were negative. The last report we’ve seen from the laboratories have about a seven plus percent positivity rate. Still, 93 plus percent or 92% are negative. But I think that’s encouraging to me personally that we’re prioritizing appropriately to those areas that have the greatest need."
2020-03-18,34:28,Deborah Birx,"Today and yesterday, Thermo Fisher pushed out most of their laboratory testing capacity and that will dramatically increase the app platform and the ability to run additional tests in addition to Roche."
2020-03-18,34:43,Deborah Birx,"So I appreciate everybody’s attention to these numbers. I’m excited that we’ve prioritized where the need was the greatest. But again, please follow the guidance and please make sure in every report that you’re putting out that you’re talking about the presidential guidance to actually stop the spread of this virus. Thank you."
2020-03-18,35:02,Donald Trump,"Thank you, Deborah, very much. Mark, please."
2020-03-18,35:08,Mark Esper,"Sure. Thank you, Mr. President. So good afternoon, everyone. And I want to provide an update on DOD’s coronavirus efforts. As we continue to focus on our three priorities, that’s first of all, protecting our personnel and their families, second, safeguarding our national security mission capabilities and third, of course, supporting the administration’s whole of government approach."
2020-03-18,35:27,Mark Esper,"First of all though, I do want to assure the American people that the United States Military remains ready and capable of defending the country and our interests abroad. Now with that, the department is leaning forward in our response to COVID-19. We have issued international and domestic travel restrictions to all DOD personnel and families that should dramatically reduce potential exposure to the virus. Those have been in place for some time now."
2020-03-18,35:52,Mark Esper,"As I announced yesterday, the Department of Defense will make available up to 5,000,000 N95 respirator masks and other personal protective equipment from our own strategic reserves to the Department of Health and Human Services for distribution. The first one million masks will be available immediately. We are also prepared to distribute to HHS up to 2000 operational deployable ventilators for use as needed."
2020-03-18,36:15,Mark Esper,"Yesterday, I was at Fort Dietrich, Maryland, which is probably the military’s premier research institute where I got updated on the incredible work our people are doing as part of the inter agency team to work on vaccines and therapeutics. They are making great progress there."
2020-03-18,36:29,Mark Esper,We also have announced that we’ve certified our 16th lab or will soon certified our 16th lab to help with processing tests from across the country.
2020-03-18,36:40,Mark Esper,"Additionally, I have directed, as the president mentioned that, the hospital ships, Mercy and Comfort be prepared to deploy to increase the nation’s medical capacity. And we have also alerted a variety of filled and expeditionary hospitals to be prepared to deploy as well as needed based on direction from the commander-in-chief."
2020-03-18,36:57,Mark Esper,"Today, leadership from the Army Corps of Engineers is in New York meeting with Governor Cuomo and his team. I spoke with Governor Cuomo yesterday and other governors. I will be speaking to more in the coming days to make sure that they know what DOD could provide through our system to address their needs."
2020-03-18,37:13,Mark Esper,"In my conversations with governors and members of Congress about DOD’s resources, I’ve made it clear that we will continue to support the administration’s comprehensive efforts and the country every step of the way while ensuring our nation’s security remains the top priority."
2020-03-18,37:28,Mark Esper,"I want to conclude by thanking again, all of our service members and their families who have been affected by this outbreak. They are all great heroes. We are continued to support them throughout this. We are all in this together. Thank you all very much."
2020-03-18,37:39,Donald Trump,"Thank you very much, Mark. Seema, please."
2020-03-18,37:44,Seema Verma,"Thank you. So yesterday the president made a very important announcement about telehealth, and this is allowing our 62 million seniors to be able to get some medical services from the safety of their home, reducing their risk and without any copays. But we’re also making sure that the healthcare system is repaired and that those on the front lines have the support that they need."
2020-03-18,38:04,Seema Verma,"The reality is, the stakes are high and we need to preserve personal protective equipment for those that are on the front lines of this fight. And to that end, we have put out guidelines over the last two weeks to expand the types of masks that can be used in routine care and saving those N95s for the most risky situations."
2020-03-18,38:22,Seema Verma,"Conserving personal protective equipment is also essential to combat the virus. So today, CMS will announce detailed recommendations to further promote this needed conservation, specifically by limiting non-essential elective medical and surgical procedures, including dental procedures."
2020-03-18,38:43,Seema Verma,"We believe that these recommendations will help surgeons, patients, and hospitals prioritize what is essential while leaving the ultimate decision in the hands of state and local health officials and those clinicians who have direct responsibility to their patients. And we urge providers and clinicians and patients to seriously consider these recommendations. They will not only preserve equipment, but it also allows doctors and nurses to help those that are on the front lines. And it’ll protect patients from unnecessary exposure to the virus."
2020-03-18,39:16,Seema Verma,"We fully appreciate that this is going to have a major impact on the healthcare system, but the shared sacrifice is essential to help those that are on the front lines. And I want to thank the medical societies such as the American College of Surgeons and the American Dental Association that took a proactive approach and already posted these recommendations. And we’ve also talked to the American Medical Association and they have fully indicated their support for this recommendation. We now invite the entire healthcare community to join us in this effort. Thank you."
2020-03-18,39:46,Donald Trump,Thank you very much.
2020-03-18,39:48,Mike Pence,Robert.
2020-03-18,39:49,Donald Trump,"Robert, please."
2020-03-18,39:51,Robert Wilkie,"Thank you, Mr. President. My instructions from the president were very clear. I was to do everything imaginable as aggressively as possible to protect the nine and a half million veterans who are part of the Department of Veterans Affairs."
2020-03-18,40:06,Robert Wilkie,"Last month, we established 19 emergency operations centers across the country and we began to limit the number of visitors who entered our facilities. We were the first system to begin triaging across the country in our 170 hospitals, the entrance of anyone into our facility without being questioned or tested. We expanded those restrictions to those in our 135 community living centers, which have about 7,800 veterans who are in acute, in acute conditions to make sure that they were protected."
2020-03-18,40:45,Robert Wilkie,We also took the next step and made sure that we limited the dental surgeries that we provided. We’ve cut back by one third the number of routine appointments we have had and we have canceled elective surgeries. These were all part of the president’s directive to be as aggressive in a public health sense as we could be and I think we have set the pace for the entire country.
2020-03-18,41:13,Robert Wilkie,"I will say, we’ve often said that we work the most noble mission in the federal government. Our veterans have been in the toughest spots in the world. They have been put in conditions that are unimaginable to most Americans and they have responded. They have responded clearly. They have responded with passion and also, the 400,000 members of our department who are out there on the front lines."
2020-03-18,41:40,Robert Wilkie,"The last thing I will say is that, you have heard a lot about the fourth mission that VA has. Our first three missions are healthcare, benefits and memorial affairs. Our fourth mission is to support the federal government in times of natural disasters and pandemics. We are the buttress force in case that FEMA or HHS calls upon us to deploy medical professionals across the country to meet crises. We plan for that every day. We are gaming out emergency preparedness scenarios and we stand ready when the president needs us to expand our mission. Thank you."
2020-03-18,42:15,Donald Trump,"Thank you very much, Robert. Thank you. Thank you, all. That’s very nice. Any questions, please?"
2020-03-18,42:22,Group,Mr. President. [crosstalk 00:42:22].
2020-03-18,42:22,Donald Trump,Go.
2020-03-18,42:23,Reporter #1,"[inaudible 00:42:23] two questions, if I may. Your treasury secretary was on Capitol Hill talking about the potential for what could come and he said that unemployment could skyrocket to 20%. That could rival the Great Depression. Are we looking at potentially historic-"
2020-03-18,42:39,Donald Trump,"No. Well, I don’t agree with that."
2020-03-18,42:39,Reporter #1,… devastation?
2020-03-18,42:41,Donald Trump,"Yeah. No, I don’t agree. That’s a absolute total worst case scenario. But no, we don’t look at that at all."
2020-03-18,42:47,Reporter #1,Okay. Thank you. And my second question-
2020-03-18,42:48,Donald Trump,We’re nowhere near it.
2020-03-18,42:49,Reporter #1,"Okay. Why do you keep calling this the Chinese virus? There are reports of dozens of incidents of bias against Chinese Americans in this country. Your own aid, Secretary Azar says he does not use this term. He says, “Ethnicity does not cause the virus.” Why do you keep using this?"
2020-03-18,43:06,Donald Trump,Because it comes from China.
2020-03-18,43:06,Reporter #1,A lot of people say it’s racist.
2020-03-18,43:08,Donald Trump,"It’s not racist at all. No, not at all. It comes from China, that’s why. It comes from China. I want to be accurate."
2020-03-18,43:15,Reporter #1,Do you know the concerns about Chinese Americans in this country?
2020-03-18,43:15,Donald Trump,"Yeah, please, John."
2020-03-18,43:16,Reporter #1,"To the aids behind you, are you comfortable with this term?"
2020-03-18,43:19,Donald Trump,"I have great love for all of the people from our country. But as you know, China tried to say at one point, maybe they’ve stopped now, that it was caused by American soldiers. That can’t happen. It’s not going to happen, not as long as I’m president. It comes from China. John, please."
2020-03-18,43:39,John,"Two question if I could, Mr. President? First of all, the Defense Procurement Act, you’re invoking it today."
2020-03-18,43:44,Donald Trump,Yes.
2020-03-18,43:44,John,"Senator Schumer said on the floor a short time ago, that it urgently needs to be put into action to produce medical supplies, particularly ventilators."
2020-03-18,43:53,Donald Trump,Yep.
2020-03-18,43:53,John,Do you have some targets that you would like to see immediately spooled up under the act?
