date,timestamp,speaker,text
2020-03-18,43:56,Donald Trump,"We do have. We have tremendous numbers of ventilators, but there has never been an instance like this where no matter what you have, it’s not enough. That would be the case. It’s being signed. It’s essentially drawn and I’m going to sign it in just a little while. If we need to use it, we’ll be using it at full speed ahead."
2020-03-18,44:16,John,"Right. You said, “It’s urgently needed to be used.” Do you have some targets?"
2020-03-18,44:19,Donald Trump,"Well, we’re going to know whether or not urgent, but we will… Yeah, we do have targets. We have targets for certain pieces of equipment. We have targets for masks, you know, the masks, the numbers of masks are incredible. We’ve ordered millions of them, but we need millions more. A thing like this has never been requested. We’ve never had to even think in terms of these numbers, but we need millions of masks and all of that will be ordered. We need respirators. We need, ventilators is a big thing because it’s a complex piece of equipment. So we have a lot of ventilators, but we’re going to be ordering more."
2020-03-18,44:51,John,"And second question, what size will the checks be that will be sent out to Americans?"
2020-03-18,44:55,Donald Trump,"To be determined. We’re working with the Senate right now. We’re working with everybody on Capitol Hill. There has been tremendous… There really has been. I mean, with some exceptions obviously because it’s always the way it is. They have been getting along very well, Republicans and Democrats. It’s a nice thing, very bipartisan, and so forth."
2020-03-18,45:13,John,Would you like to see them more than a thousand dollars?
2020-03-18,45:15,Donald Trump,"Well, we’re going to see. I don’t want to get into that right now, John. We are looking at different numbers. We’re looking at timing. That would be different, splitting the time, splitting the payments. We’re looking at a lot of different things. It hasn’t been determined yet, but it will shortly be determined and people want to go big as opposed… Everybody seems to want to go big and they want to get to the recovery. The big thing we can do is get rid of this horrible, I call it the unseen, the unseen enemy, you call it. There is a thousand different terms for it. It snuck up on us. It did 128 countries, I think. It’s in something like that, very close to that. Think of that, so it spreads violently. It’s a very contagious, very, very contagious virus."
2020-03-18,46:01,John,Do you consider America to be on a wartime footing in terms of fighting this virus?
2020-03-18,46:04,Donald Trump,"I do. I actually do. I’m looking at it that way because, you know, if it got out of control. The big thing we did was a very early stoppage of people coming in who could be very, very heavily infected. It was a very good move and it was very early, very, very early when most people, including a lot of professionals, they didn’t want us to do it. That really saved a lot of lives. And yeah, I look at it. I view it as a, in a sense, a wartime president. I mean, that’s what we’re fighting. It’s a very tough situation. You have to do things. You have to close parts of an economy that six weeks ago were the best they’ve ever been. We had the best economy we’ve ever had. And then one day, you have to close it down in order to defeat this enemy. But, we’re doing it and we’re doing it well. And I’ll tell you, the American people have been incredible, for the most part, they’ve been really incredible. Yeah, please, [Kaitlin 00:20:57]."
2020-03-18,46:58,Kaitlin,I have a question for you and then I have one for Secretary Wilkie as well.
2020-03-18,47:00,Donald Trump,Sure.
2020-03-18,47:00,Kaitlin,"But I’ll start with you. You just said there are a tremendous number of ventilators that we have, but for weeks hospitals have been warning about a critical shortage that they say we are not prepared for. So why did it take so long to invoke the Defense Production Act?"
2020-03-18,47:13,Donald Trump,"Well, you know, hospitals are supposed to have ventilators too. And when we have thousands of ventilators, it sounds like a lot, but this is a very unforeseen thing. Nobody ever thought of these numbers. Nobody ever saw numbers like this, even with regard to testing. Normally, we wouldn’t be doing testing and they decided to do it, very, very hard to ramp up. Now, we’re getting highly sophisticated tests and it’s going very well. But, nobody has ever heard of testing in the kind of quantities that you’re talking about."
2020-03-18,47:40,Kaitlin,"But we knew for weeks we needed more ventilators, so why did it take so long?"
2020-03-18,47:42,Donald Trump,"Well, we knew. It depends. It depends on how it goes. Worst case, absolutely, a best case, not at all, so we’re going to have to see where it goes. But we are ordering thousands and thousands of ventilators and they’re complex. You know, these are complex machines. But, we’re ordering them. Does anybody have a, Mike maybe you do, how many do we have?"
2020-03-18,48:04,Kaitlin,"Yeah, you said you’d get back to us with those numbers."
2020-03-18,48:07,Donald Trump,"Please. Yeah, please. Do you know the number?"
2020-03-18,48:08,Kaitlin,The exact number?
2020-03-18,48:09,Mike Pence,"We have a specific number of ventilators in the stockpile. It’s in excess of 10,000 and you just heard the announcement from the Department of Defense. They’ll be adding several more thousand to that. But the president, even this morning and yesterday afternoon, speaking with the largest companies in the supply chain in this country, we’re hearing a tremendous spirit among industry leaders who are ready to step in and add to that volume. The stockpiles don’t count all of the ventilators that exist today in the marketplace and in healthcare facilities around the country."
2020-03-18,48:43,Mike Pence,"But, the president has given us a directive to make sure that our stockpile, but just as importantly working with industry leaders that we’re securing the increase in ventilators, the increase in masks, gloves, eye protective care, garments that are all necessary to lean forward and [crosstalk 00:49:02] we’re confident we’ll be able to accomplish that with the incredible cooperation of the supply chain that exists in America today."
2020-03-18,49:14,Kaitlin,"But, we don’t have an exact number for nationwide. How many ventilators do we have?"
2020-03-18,49:14,Donald Trump,We can give you that exact number. We’ll give it to you.
2020-03-18,49:14,Kaitlin,Okay. [inaudible 00:49:13].
2020-03-18,49:14,Donald Trump,But we’re ordering a lot more.
2020-03-18,49:15,Kaitlin,"Okay, sir. That’s [crosstalk 00:49:15]."
2020-03-18,49:15,Donald Trump,"Yeah, go ahead in the back, yes."
2020-03-18,49:20,Kaitlin,I have a question for the VA secretary.
2020-03-18,49:20,Reporter #2,"Mr. President, two question."
2020-03-18,49:20,Kaitlin,I have one question for [crosstalk 00:49:19].
2020-03-18,49:20,Donald Trump,"Yeah, one second. One second, Kaitlin. We’ll do it in a second."
2020-03-18,49:22,Kaitlin,Okay.
2020-03-18,49:23,Donald Trump,You’ll be able to do it.
2020-03-18,49:23,Kaitlin,"Okay, it’s important."
2020-03-18,49:23,Reporter #2,"Two questions, Mr. President. Thank you."
2020-03-18,49:25,Donald Trump,Yes.
2020-03-18,49:25,Reporter #2,"The first one on the Canadian border, what was the tipping point? Friday, we talked about it. Then Monday you said, no one knew. We’re not considering closing the border."
2020-03-18,49:32,Donald Trump,"No, I said not yet. I spoke with the prime minister, Trudeau, a very good relationship obviously between us and our two countries and no tipping point. It’s just that we want to isolate from the standpoint we don’t want people coming into contact because that’s the way we’re going to win this war. That is so important and we both thought it was time."
2020-03-18,49:53,Donald Trump,"Now it’s not affecting trade. It’s non-essential. It’s non-essential crossings. It won’t affect trade at all. And it was just something we thought would be good for both countries. Yes, please. [crosstalk 00:24:04]."
2020-03-18,50:06,Reporter #2,"The second question, Mr. President. How can you be sure that trade-"
2020-03-18,50:08,Donald Trump,"Go ahead, please."
2020-03-18,50:09,Reporter #2,"… is not going to be a factor of the virus? How can you be sure that trade and everything that’s being shipped from one side, [crosstalk 00:50:14]?"
2020-03-18,50:15,Donald Trump,"Well, they’re doing it in a very careful manner. You can only be vigilant and very professional. It’s not pertaining at this moment to trade between the two countries."
2020-03-18,50:26,Reporter #2,"Thank you, sir."
2020-03-18,50:27,Donald Trump,"Yeah, please."
2020-03-18,50:27,Reporter #3,"We are hearing that the trillion dollar economic stimulus package could look something like $50 billion for the airlines, $150 billion dollars in loan guarantees for critical sectors in the economy, a $250 billion dollar payment on April 6th directly to individuals, another $250 billion dollar payment on May 18th, again, directly to individuals and as well $300 billion dollars for small business loan guarantees. Is that, in the general sense, of what you’re looking at?"
2020-03-18,50:53,Donald Trump,"It could be. It could be. And we’re also playing with a lot of numbers, a lot of very big numbers and a lot of very small numbers, frankly. We want to take care, we have to help everybody. It was nobody’s fault this happened. I mean, some people could say it was somebody’s fault actually, but it was nobody’s fault. And certainly none of these companies that all of a sudden had no passengers in planes and had no passengers on cruise ships and all of the things that have happened. But I will say that, they can’t be blamed for this. And we want to keep those companies vibrant because it’s, there is going to be a comeback very, very quickly as soon as this is solved. And it will be solved. We will win. And there will be a comeback and it’ll take place very quickly."
2020-03-18,51:36,Reporter #3,"[inaudible 00:51:36] $50 billion dollars. There is, give or take, 330 million Americans or, so if you just do the math on that, that’s about $750 a person, a family of four, that would be about $3,000 on average, again, rough, rough map, which is that where this is headed? It’s actually thousands of dollars."
2020-03-18,51:52,Donald Trump,"Well, I don’t want to say that because it’s a moving… Every number that you mentioned, yes, we’ve talked about those numbers. We’re also moving those numbers in both directions, so we’ll let you know. It’s moving along fast."
2020-03-18,52:03,Donald Trump,"What directions, so we’ll let you know. It’s moving along fast. Again, there’s a great bipartisan effort going on that I haven’t really seen before to this extent."
2020-03-18,52:14,Speaker 5,"On the [inaudible 00:52:14] swab that you mentioned at the beginning of this, has the FDA approved that test?"
2020-03-18,52:18,Donald Trump,"No. They’re looking at it. It’s down the line, and they’re looking at it very seriously. And I think it would be a great thing, because the others, to use a nice word, it’s very inconvenient. It’s very tough."
2020-03-18,52:28,Speaker 5,"I’ve got a question for you, sir. You tweeted this morning about your approval rating amongst Republicans. You have said that you give yourself a 10 in terms of handling this crisis. How do you reassure Americans at home who don’t trust you to handle a crisis of this magnitude?"
2020-03-18,52:42,Donald Trump,"Well, I think we’re doing a really good job. We started off with a termination of the border, the people coming in from China where this all started. That meant I took it very seriously. And when I use the word calm, calm doesn’t mean that I’m not taking it seriously, and we should be calm. We should be extremely calm. But yeah, 95% within the Republican party and over 50%, and, also, we have very great approval numbers. People like the job that we’re doing. And when you compare this to other epidemics, or if you want to use a different term, you can, but within this country, and you look at what’s happened over the years, this is being handled very, very professionally."
2020-03-18,53:24,Donald Trump,"We have the greatest professionals in the world. We’re doing a good job. Nobody’s ever been swamped like this, and nothing’s been so contagious. The level of contagion has been incredible, actually. Nobody’s seen anything quite like this."
2020-03-18,53:37,Donald Trump,"Yeah, Peter, go ahead."
2020-03-18,53:38,Peter,"If I can ask you about the tests, sir, for a second. If federal officials have shipped millions of tests as you and your colleagues have said, why is the federal government says only 59,000 tests been processed to this point. We just heard from the Atlanta public health director saying that they have fewer than 50 test kits for more than 900,000 citizens. Where are the tests?"
2020-03-18,54:01,Donald Trump,I’ll let Mike answer that.
2020-03-18,54:04,Deborah Birx,"So that’s a very critical question, and thank you for asking it. So the test kits that we put out last week through the rapid movement of that meeting that president Trump called less than two weeks ago, that has resulted in bringing our private sector to the table, because the tests and the platform that was out there could only run between four and 12 tests per platform per day. We’ve now moved into platforms that can run basically tens of thousands of tests per day. So yeah, the reason I’m grateful for your question, because it allows me to point out that a course then there was backlog. There were individuals who had been tested who hadn’t had their specimen run because of the slow throughput. It’s now in a high speed platform. So we will see the number of people diagnosed dramatically increase the next four to five days."
2020-03-18,55:01,Deborah Birx,"I know some of you will use that to raise an alarm that we are worse than Italy because of our slope of our curve. To every American out there, it will be five to six days worth of tests being run in 24 to 48 hours. So our curves will not be stable until sometime next week. The reason I talked about Thermofisher yesterday is because their platform is in 2, 000 laboratories. They’re the ones that are putting out the million tests this week that will solve the issue that Atlanta and others have brought up. I wanted to be clear, we prioritize the areas. We do County by County analysis based on those analyses, on what counties had more than 50 cases, we prioritize the test kits we put out, the 400,000. And that’s why we’re seeing a 7% plus positivity rate. We’ll be able to expand that platform and reprioritize based on the accessibility of the other kits."
2020-03-18,56:06,Peter,"Mr. President, perhaps I can follow up. How are non-symptomatic professional athletes getting tests while others are waiting in line and can’t get them? Do the well connected go to the front of the line?"
2020-03-18,56:16,Donald Trump,"You’d have to ask them that question. No, I wouldn’t say so, but perhaps that’s been the story of life. That does happen on occasion, and I’ve noticed where some people have been tested fairly quickly. Look, we inherited a very-"
2020-03-18,56:31,Peter,Would you encourage them to defer a test to other?
2020-03-18,56:34,Donald Trump,"Excuse me, excuse me. We inherited a very obsolete system. This was a system that was out of date, obsolete, or it was a system that was never meant to take care of the kind of quantity, the number of people that we’re talking about. Millions and millions of people. If you go back in years past, like even recently with the flu, nobody had tests before. They didn’t test the entire nation to see whether or not they had flu. They got the flu, they got better. Hopefully they got better. That was it. Now all of a sudden, they do this very complex testing."
2020-03-18,57:05,Donald Trump,"What we’ve done is we broke it down. We broken up the system, but it was obsolete and/or you could say it was also a system that just wasn’t meant to handle the kind of volume that you’re talking about. We’ve rebuilt it into a system that, for the future, will be a very good system if you want to go this route. But this was never done before, and I would imagine it will be done in the future, but we built it into a very good system by using private companies, the great private companies. And I have to say Roche has been doing a very good job. They’re doing a lot of work, a very good job."
2020-03-18,57:36,Donald Trump,But this was an obsolete system. This was not a system that was meant to do anything like this or even near this.
2020-03-18,57:42,Donald Trump,John?
2020-03-18,57:43,John,"Mr. President, a couple things. A major train coalition is calling on you to suspend tariffs with other countries as part of the response to the coronavirus."
2020-03-18,57:53,Donald Trump,"Who heads that group? Those countries do, probably. Go check."
2020-03-18,57:57,John,It’s an American free trade.
2020-03-18,57:58,Donald Trump,"I know, I’m sure of free trade… Look, China’s paying us billions and billions of dollars in tariffs, and there’s no reason to do that. They haven’t even spoken to me about that. China hasn’t asked me to do that, but we’re getting billions of dollars a year from tariffs from China, and I can’t imagine Americans asking for that. But it could be that China will ask for a suspension or something. We’ll see what happens. China’s having a very rough time. They have their worst year in 76 years as I understand it. They’re having a very, very tough time. And then on top of it, this happened with the virus."
2020-03-18,58:31,Donald Trump,"But no, we’re taking in billions of dollars a year in tariffs. And this was caused by something totally unrelated to tariffs."
2020-03-18,58:39,John,"On asylum seekers and people who crossed the Southern border illegally, are you planning to invoke 42 U.S.C. 265, which would allow you to prohibit entry of certain people?"
2020-03-18,58:51,Donald Trump,The answer is yes.
2020-03-18,58:53,John,When will that happen?
2020-03-18,58:53,Donald Trump,"Very soon. Probably today, yes."
2020-03-18,58:57,Speaker 7,"[crosstalk 00:58:57] question for Dr. Birx. On the border, firstly, are there plans to fully shut the Mexican border, and what do you define as essential travel when it comes to the U.S. Canadian border?"
2020-03-18,59:06,Donald Trump,"Well, I think essential is medical. We have military working together. We have industry working together. And again, it’s not affecting trade. So things like that, but just leisurely, let’s go to a restaurant and have dinner, which a lot of people do. They come both ways. They go in both directions, that kind of thing, we have ended on a temporary basis. Yeah, please go ahead."
2020-03-18,59:28,Speaker 7,Are you planning to close the Southern border?
2020-03-18,59:29,Donald Trump,"Not close it. No, we’re not going to close it, but we are invoking a certain provision that will allow us great latitude as to what we do."
2020-03-18,59:38,Donald Trump,Please.
2020-03-18,59:38,Speaker 7,May I ask her questions if I could?
2020-03-18,59:40,Donald Trump,"Yeah, go ahead. You know what? Go ahead. Sure."
2020-03-18,59:41,Donald Trump,Doctor.
2020-03-18,59:43,Speaker 7,"So trying to clarify something, because just a week ago, you all were standing here telling us that unless you had sustained contact with somebody who is symptomatic for COVID 19, you really didn’t need to worry. You told the president, the vice president, that if they shook hands with somebody who had this, if they took a photograph with somebody who had this, he didn’t really need to worry, and yet, several days later, we’re in a situation where people are being told, “Don’t leave your houses.” There are curfew saying, “You can not walk alone at night after a certain time.” Can you walk us through what seems like a very dramatic swing, a very dramatic disconnect from what we were hearing before to what we’re hearing now."
2020-03-18,01:00:17,Deborah Birx,"So two things. We look at data all the time, and I know you’re looking at the China and South Korea data. And when you look at China and South Korea data and you look what China and South Korea did, you could see that their curves are not only blunted outside of Wuhan, so the Chinese areas outside of Wuhan blunted curve and South Korea blunted curve. If you look at their curve today, they’re already on the far end of their epidemic curve. Of course, none of those countries are fully back to work. And so that’s what we worry about, too."
2020-03-18,01:00:52,Deborah Birx,"Secondly, there was a series of scientific articles published, and I know you’ve seen them, too, about surface contamination. I think none of us really understood the level of surface piece. So we’re still working out how much is it by human-human transmission and how much is it by surface. And this is why those fundamental guidelines were put out that that says, “Don’t expose yourself to surfaces outside the home.”"
2020-03-18,01:01:18,Deborah Birx,"Basically, what those guidelines are is don’t expose yourself to excess number of persons who could be asymptomatic and infected and then the person to person contact, and don’t expose yourself to surfaces that could have had the virus on it, for which on hard surfaces, I know we had the cardboard issue about shipping, hard surfaces, not shown in fabric as much or in cardboard, but hard surface transmission. These are issues that we haven’t had to deal with before with the level of respiratory infections, and that’s why we have this concern, and that’s why the president put out the guidelines. And so it’s to cover both of those pieces. That’s all new science, all new models. I think many of you have the imperial study available and looked at the impact of those. That’s the first time those have been modeled as a comprehensive approach to mitigating an epidemic."
2020-03-18,01:02:10,Donald Trump,Go ahead.
2020-03-18,01:02:14,Jennifer,"Mr. President, the Wall Street Journal is reporting that the administration would look into executive order that would expand the use of investigational drugs against the virus, but the FDA scientists are warning that this could put patients at risk. It’s something you’re looking at?"
2020-03-18,01:02:29,Donald Trump,"No, I haven’t seen the article. We are making a lot of progress therapeutically. I will say that, but I have not seen that article, no."
2020-03-18,01:02:36,Donald Trump,Go ahead.
2020-03-18,01:02:39,Speaker 8,"Mr. President, we’ve shut down non essential travel to Canada. Are you considering shutting down all travel to brunt the spread of the virus, and we’ve heard from industries like the airlines who are seeking relief. What other industries, or how exactly is your administration going to determine which industries and businesses get the help they need?"
2020-03-18,01:03:02,Donald Trump,"There were certain industries that people know. The airlines would be number one if you look at what’s going on. They go from having the best year they’ve ever had to having no passengers because of what we’ve had to do in order to win this war. It’s a war, and so basically, you know what many of the industries are. What we want to do is we want to make sure they all stay together so that after the war is won, we can immediately go right back up to where we were and even beyond. I think we’re going to go beyond where we were, and a lot of people are saying that by the way. We’re poised to do that, but we have to win the war first."
2020-03-18,01:03:34,Donald Trump,"Yeah, please go ahead."
2020-03-18,01:03:35,Speaker 9,"Thank you. To follow up on that, treasury proposed $150 billion dollars today for those industries, but their proposal doesn’t detail which industries would get that money and how much. So aside from the airlines, which you just mentioned, what about the cruise industry, the hotels? How much of that money do you see them each year?"
2020-03-18,01:03:52,Donald Trump,"We’re talking about all of it. Haven’t detailed it yet. We have detailed it to senators and to members of the House. We have been talking about it, and we’re coming up with numbers. Haven’t gotten there yet, but certainly hotel industry, the cruise ship industry, the airlines. Those are all prime candidates. Absolutely."
2020-03-18,01:04:11,Speaker 9,"On the Northern border, sir-"
2020-03-18,01:04:13,Donald Trump,Which border?
2020-03-18,01:04:14,Speaker 9,"The Northern border. When you say temporary, which is what you said in your tweet, does that mean it’s 30 days?"
2020-03-18,01:04:20,Donald Trump,"I would say 30 days, and hopefully at the end of 30 days, we’ll be in great shape."
2020-03-18,01:04:25,Donald Trump,"Jeff, please."
2020-03-18,01:04:27,Jeff,"Mr. President, I was struck by what Dr. Birx said about millennials and others perhaps not taking some of these warnings as seriously as you would like. Some of those people also seem to be your supporters and conservatives who may be quoting some of what you said at the beginning of this, comparing it to the flu. What is your message to them to really follow what you’ve been saying so far, and are you concerned that they’re still listening maybe to some of your earlier comments rather than your more recent ones?"
