date,timestamp,speaker,text
2020-03-18,01:04:54,Donald Trump,"Well, I think my earlier comments are to be calm. I do want people to be calm, because we’re going to win this. And we’re going to win it, it’s just a question of time ,and I want it to go quickly. So based on the fact that I want it to go quickly, I hope they just listened to what we’ve been saying over the last period of time. We don’t want them gathering. And I see they do gather, including on beaches and including in restaurants, young people. They don’t realize. They are feeling invincible. I don’t know if you felt invincible when you were very young, but they were feeling totally invincible, or are feeling that way, but they don’t realize that they can be carrying lots of bad things home to grandmother and grandfather and even their parents. So we want them to heed the advice. We made the advice, and I think it’s getting through. I do believe it’s getting through."
2020-03-18,01:05:39,Donald Trump,"Jim, please."
2020-03-18,01:05:39,Peter,And what do you say to them if they’re watching?
2020-03-18,01:05:41,Donald Trump,If they’re what?
2020-03-18,01:05:43,Peter,"I think there are a lot of them watching. A lot of these people at home, these young people."
2020-03-18,01:05:45,Donald Trump,Well I think I just said it.
2020-03-18,01:05:46,Peter,I was going to say what do you say to them?
2020-03-18,01:05:48,Donald Trump,"Heed the advice. I just said. Yeah, thank you. Thank you, Peter."
2020-03-18,01:05:59,Speaker 8,"Thank you, Mr. President. In talking about China, you’ve been very clear about who you think is to blame or where the origin to blame for this virus is."
2020-03-18,01:06:06,Donald Trump,"Not think. No, no, I don’t think, I know where it came from. I don’t know if you’d say China’s to blame. Certainly, we didn’t get an early run on it. It would have been helpful if we knew about it earlier, but it comes from China, and it’s not a question about that. Nobody’s questioning that."
2020-03-18,01:06:22,Speaker 9,"So Senator Cotton is saying that they should be punished, in so many words, for inflicting this on the American people. Do you feel that way about it?"
2020-03-18,01:06:32,Donald Trump,"Well, I have a lot of respect for Tom Cotton, and I know exactly what he’s been saying. And there are those people that say that. So we’ll see what happens. Thank you."
2020-03-18,01:06:41,Donald Trump,[crosstalk 00:14:41].
2020-03-18,01:06:41,Donald Trump,It’s your turn. Go ahead.
2020-03-18,01:06:43,Donald Trump,[crosstalk 00:14:45].
2020-03-18,01:06:43,Donald Trump,"Please. He’s been waiting a long time, please. You’ve had your hand up so nicely for a long. It’s your time."
2020-03-18,01:06:51,Speaker 10,"Thank you sir. We’ve seen the Chinese government kick out reporters from the Wall Street Journal, the New York Times, the Washington Post. What is your message to the Chinese when it comes to transparency at a moment when you still have reporters asking you questions here at the White House?"
2020-03-18,01:07:05,Donald Trump,"Yeah, I’m not happy to see it. I have my own disputes with all three of those media groups. I think you know that very well, but I don’t like seeing that at all. I’m not happy about that at all."
2020-03-18,01:07:19,Donald Trump,"Yes, please."
2020-03-18,01:07:19,Speaker 8,I wonder if you agree with it. Do you believe that China is inflicting this upon our country?
2020-03-18,01:07:25,Donald Trump,"No, I don’t believe they’re inflicting. I think they could have given us a lot earlier notice, absolutely. Please."
2020-03-18,01:07:33,Speaker 6,"Yeah, Mr. President, your credibility ratings are very low. There was a recent NPR poll-"
2020-03-18,01:07:39,Donald Trump,"Who are you asking of that question, because I see that they’re very high. If you look, I’m 95% of the Republican party. We just had a poll that was done by a very reputable group. We’re beating sleepy Joe Biden by a lot in Florida, the state of Florida, and in other states. So I don’t really know who you’re talking about."
2020-03-18,01:08:02,Donald Trump,"Jennifer, go ahead, please. Please."
2020-03-18,01:08:03,Jennifer,I have two questions if you’re willing to. Would you give us an update on your conversation with the airline executives? Did you explain to them what’s coming? What was their reaction?
2020-03-18,01:08:12,Donald Trump,"I did, and they explained to me where they’re coming from. They went from, as I said, full planes packed, the best year they’ve ever had by far to, boom, one day empty because of what we have to do to win this war, or we would have a level of death like people haven’t seen before. So they’ve been fantastic. They’ve been great, but they went from being extremely happy to being people that are running companies that are going to need some help, and we’ll help them, Jennifer."
2020-03-18,01:08:45,Jennifer,"On SBA laws, would you be willing to give us an update on how that’s going? We’ve been getting some reports that counties have been having difficulty getting [crosstalk 01:08:54]."
2020-03-18,01:08:53,Donald Trump,"It’s going. There’s a lot of influx to those loans, as you could imagine. A lot of people are looking at it, but we’re going to be increasing funding a lot, and they’re very well prepared to do what they have to do. And the SBA is doing a fantastic job. She is doing a really good job, the administrator."
2020-03-18,01:09:08,Donald Trump,John?
2020-03-18,01:09:10,John,"Questions for Dr. Birx, if I could? Dr. Birx, French researchers have had some luck with hydroxychloroquine in shortening the duration of disease. Is that something that might be in the arsenal therapeutics here in the United States?"
2020-03-18,01:09:25,Deborah Birx,"I think we are exploring every one of those issues. The president asked for a critical briefing on that today. He opened with that. It is more than that single drug. There are other drugs that individuals are looking at. Just to go back to what we talked about many times, there is things that look really good in cell culture against the virus that may look good in small animals, and then don’t have an impact in humans. And so those are the pieces that we’re looking at very carefully. Of course, there’s always anecdotal reports, and we’re trying to figure out how many anecdotals reports equal real scientific breakthroughs."
2020-03-18,01:10:03,John,"Second question, are you confident of the seasonality of Coronavirus?"
2020-03-18,01:10:09,Deborah Birx,"All we can do is look at the past to inform the future. We know what SARS looked like. We also know, and I just want to put this out, I know you can get it online, look at the curve in China and look at the curve in South Korea. Those curves were accomplished in still the winter season. And so we’re trying to understand what those relationships are. We’re very interested in the curves in Italy because of their different approach and we’re following every single country’s curves. And so all we can do is look at prior Coronavirus and prior respiratory infection, RNA viruses. These are RNA viruses. When you look at flu in the Northern hemisphere, when you look at parainfluenza and some of the other cold viruses, and if you look at SARS, that’s the way the peak normally occurs, but that is a November to April. We all started later. And so you’re asking me to predict based on a later start, and that’s what we’re trying to really look at china and South Korea to really inform that."
2020-03-18,01:11:19,Donald Trump,"[Katelyn 00:01:11:22], go ahead."
2020-03-18,01:11:20,Katelyn,"A question for Secretary Wilkie, if you don’t mind, or you can answer if you’d like. How many veterans of those that you need to be tested have been tested?"
2020-03-18,01:11:27,Robert Wilkie,"Those that have needed to be tested, we believe we’ve caught most of them. Right now, we have 44 veterans who have tested positive. Sadly, one has passed in Portland. We are working with state labs and private companies to make sure that testing is available. Because the president had us out aggressively early, we have been in a better place than most healthcare systems in the country. I cannot predict this. Dr. Birx said when the next surge will be, if it will be, but one of the things that we do at VA is that we prepare for national emergencies, be the national disasters or epidemics. We started preparing for this. We started stockpiling equipment. Our equipment is stable, and I think that’s in large part because of the instructions the president gave me."
2020-03-18,01:12:23,Katelyn,But do you have a number of how many have been tested out of the number that you said we tested?
2020-03-18,01:12:27,Robert Wilkie,We tested several hundred. I can’t give you the direct-
2020-03-18,01:12:29,Katelyn,It was 200 the other day. Is it higher than that?
2020-03-18,01:12:30,Robert Wilkie,We’ve tested several hundred. Yes. We’ve tested several hundred. I don’t know exactly. I do know that 44 veterans have the virus. Most of those are quarantined at home.
2020-03-18,01:12:45,Donald Trump,"Go ahead in the back, please."
2020-03-18,01:12:45,Speaker 11,"Thank you, Mr. President. The question for Dr. Birx, quickly. I’m trying to understand what we… It’s about the mortality rate. Yesterday, we underlined the fact that we had reached a hundred deaths, and this morning we wake up and we’re at 110. Within 12 hours, we climbed by 10%. is it something we have to expect from now on, a 10% increase every 12 hours?"
2020-03-18,01:13:12,Deborah Birx,"So very early on in each one of these cases, if you look at all of the countries to date, the mortality is higher at the beginning because you’re diagnosing the sickest, the ones who came in quite ill. And I just want to remind the American public that the risk for serious illness in the majority of Americans are low, but that doesn’t mean that you can’t transmit it to one of those higher risk groups. And that’s why we’re asking for all Americans to take responsibility. You’re seeing mortality or deaths today from infections that occurred two to three weeks ago in general. The other thing that you’re seeing is the dramatic and very difficult impact of this virus in nursing homes. And that’s why very early on, the president and vice president had us come out, and CMS put those very strict rules in place, and everybody thought we were being too strict in keeping loved ones away from their family in nursing homes. If we’re going to solve this with a lower death rate, we have to protect the elderly because of their percent is much higher in mortality than any other age group."
2020-03-18,01:14:25,Donald Trump,"Go ahead, please."
2020-03-18,01:14:26,Speaker 8,"Mr. President, there’s reporting that the federal government has a plan that shows that this Coronavirus outbreak might last as long as 18 months. Are you seeing those numbers? Could this actually last-"
2020-03-18,01:14:37,Donald Trump,"No, we’re not seeing that at all."
2020-03-18,01:14:39,Speaker 8,"And then my second question is there are some, at least one, White House official who used the term Kung flu, referring to the fact that this virus started in China. Is that acceptable? Is it wrong? Are you worried that having this virus be talked about as a Chinese virus, that that might-"
2020-03-18,01:14:54,Donald Trump,I wonder who said that. You know who said that?
2020-03-18,01:14:57,Speaker 8,"I’m not sure the person’s name, but would you condemn the fact, the Kung flu?"
2020-03-18,01:15:00,Donald Trump,Say the term again.
2020-03-18,01:15:02,Speaker 8,"A person at the White House used the term Kung flu. My question is do you think that’s wrong, Kung flu? And do you think using the term Chinese virus, that puts Asian-Americans at risk, that people might target them?"
2020-03-18,01:15:15,Donald Trump,"No. No, no. I think they probably would agree with it 100%. It comes from China. There’s nothing not to agree."
2020-03-18,01:15:22,Donald Trump,"How about last question, please? Please, go ahead."
2020-03-18,01:15:26,Speaker 13,"Switching gears to a larger question here. We’ve seen that before the pandemic, there were a lot of Americans that were already alienated. We saw deaths of despair increasing through suicide and other things. Now, as these individuals, a lot of times they’re in rural parts of the country, are self isolating. What is your message to those individuals and what do you hope the individuals, communities and churches will do to reach out to them?"
2020-03-18,01:15:48,Donald Trump,"My message is to all Americans, but to those Americans who are going through a lot, we love them. We’re with them and we will not let them down. Thank you all very much."
2020-03-18,01:16:03,Speaker 13,"Mr. Vice President, do you agree with the term Chinese virus?"
2020-03-18,01:16:10,Speaker 8,"Dr. Birx, do you believe this is a Chinese virus? Is that okay to say?"
